index,ID,name,category,rank,desc
1,R-001,정체된 마력의 핵,item,E,끈적하고 오염된 마력을 담고 있는 핵. 저급 둔화 계열 포션이나 약한 저주 계열 장비의 재료로 사용된다.
2,R-002,여왕초의 새벽 이슬,item,E,"신비한 마력이 응축된 이슬 결정. 저등급 치유 포션의 효능을 증폭시키거나, 각성제 계열 아이템의 핵심 재료로 사용된다."
3,R-003,온전한 공명 수정,item,D,불순물 없이 순수한 공명 마력을 담고 있는 결정체. 음파나 진동 계열 스킬을 강화하는 장비의 핵심 재료로 사용된다.
4,R-004,슬픔이 깃든 종의 파편,item,C,"수백 년의 슬픔과 원념이 깃든 종의 조각. 정신계 저항 장비나, 강력한 음파 계열 마법의 촉매로 사용되는 희귀한 재료다."
5,R-005,군주의 불타는 심장,item,B,극도로 순수한 화염 마력을 담고 있는 마력원. 최상급 화염 계열 무기나 방어구에 '영구적인 열기' 같은 특수 옵션을 부여하는 핵심 재료.
